{
  "name": "Физика",
  "description": "Материалы по физике и астрономии",
  "category": "science",
  "tags": [
    "физика",
    "наука",
    "квантовая механика"
  ],
  "created": "2025-12-30T13:00:00",
  "updated": "2025-12-30T13:00:00",
  "author": "system",
  "language": "ru",
  "status": "active",
  "statistics": {
    "totalFiles": 1,
    "totalSubfolders": 0,
    "totalSize": 0,
    "fileTypes": {
      ".txt": 1
    }
  },
  "keywords": [
    "физика",
    "квантовая механика",
    "классическая механика"
  ]
}
